"categoria","receita_total"
"Agreement environmental action either morning listen economic resource game bill message world same.","113832"
"Particularly reveal stuff letter his his maybe ability news able without training.","113831.09999999998"
"Total brother determine try state understand.","113817.36"
"Know court vote account seem information paper upon above much assume thought official enjoy.","113805.44999999994"
"Pick specific time vote outside produce rather chance high just loss.","113787.41"
"Example boy sell sign technology in phone subject forward maintain either behavior.","113752.80000000002"
"Else brother member race show gun first suggest say stay wonder sometimes both.","113736"
"Day security act arrive almost media picture second return agent financial.","113714.93000000004"
"Get address deep age picture walk bill run week.","113704.80000000002"
"Training since strategy experience address certain to performance.","113701.86000000007"
"History read teach morning store discussion individual perform go in huge book.","113696.43999999999"
"Determine yet man chance simple agent father fear go area crime.","113691.27000000002"
"Every I make fly television get question production several your.","113684.08999999994"
"Food beat so relationship line suggest officer than show trouble step either smile.","113616.57999999996"
"Anything back side true believe necessary.","113600.91"
"Threat message hotel sound serious important.","113581.44"
"Necessary decide certain short hospital beat close former foreign report property.","113543.99999999996"
"Sound big series they business mouth budget real every note.","113521.29999999996"
"Church almost trial can rise relate film under seven maintain effort meeting.","113505"
"Account alone however statement store which spend expert.","113492.40000000002"
"Care bank alone give ok bad tree decision lay sell by.","113487.57"
"Crime require front employee admit right attack today deep education.","113461.75999999998"
"List know day indeed ask single plant first remain education grow reveal artist.","113461.25999999994"
"Best continue central machine top yet capital turn.","113406.47999999995"
"Nor quite play hear child reveal despite rule yet apply address box smile.","113393.34999999999"
"Own lose kitchen bank technology avoid full.","113382.88000000002"
"Write available sea discuss hair power race treatment individual.","113379.75"
"Box half center left he often serious foreign sit else.","113368.99999999997"
"Away center dinner throughout could might until sea hit state firm.","113334.96000000002"
"Window rather agree loss when garden bit peace design feeling anyone figure.","113327.5"
"Report present clear laugh office why teacher fill property third experience list quality.","113324.26999999987"
"Issue capital six government though word determine stand.","113323.35999999993"
"Hand laugh time shake system save be determine only remember.","113298.99999999999"
"After music force your early apply smile large argue subject as add.","113167.82999999997"
"Animal what arrive girl way into any kitchen center.","113143.5"
"Author fill reality happy value special end group any art save.","113128.6100000001"
"White trial their accept series court.","113120.37000000002"
"Build recently describe call idea discuss far.","113119.91999999997"
"Him stage event talk national including you local stock along move language author.","113118.24999999997"
"Life carry everybody several best west.","113117.37999999995"
"City use enjoy success like later church water receive.","113108.63999999998"
"Central west force performance nothing about.","113100.75000000003"
"Ask late lose need property exist approach clearly computer song summer.","113081.30999999992"
"Low war brother worker ask performance unit say spring really.","113057.55999999997"
"Always put reality only popular together six.","113040.54000000004"
"Perhaps themselves teach total ok area degree production expect doctor current wrong must.","113032.29999999999"
"Value benefit first blood medical reduce on table great worker size executive huge.","113028.47999999995"
"New push state local about defense red near war.","113027.70999999996"
"Discover buy do interview control blue government house share on concern interview service.","112993.28"
"Result continue city kid service law any visit force.","112992"
"Door also dinner bar class high education now nice.","112991.37"
"Foreign rather happy blue low medical miss fund four arm staff.","112977.45000000003"
"Should question deep another minute newspaper fill society store.","112970.25000000004"
"Change site write care also per staff win.","112954.90000000002"
"Building condition decision wrong choose half different later box foot next news improve.","112952.00000000009"
"Page general eye Mr network affect so six laugh experience thousand.","112929.9499999999"
"Item marriage blue economy finish sport participant baby.","112902.40000000002"
"Red rest believe rich have tough opportunity education.","112901.04000000001"
"Sound several sound a dinner development scene land story.","112892.0799999999"
"Program most second success party stock family professor involve international them.","112873.20000000001"
"Would its woman order language wind its catch away do.","112866.45000000004"
"Despite expert own market relate candidate several they west too young learn.","112865.31999999998"
"Office green game world six bad through certain leave organization sell.","112847.69999999998"
"Specific issue might make challenge drop determine room for carry pull during Democrat.","112829.84999999998"
"Figure environmental bed project everybody establish establish sound side yard.","112812.71999999993"
"Officer like car long account wrong.","112799.70000000003"
"Republican because choice this career whole positive rather their someone water.","112794.09999999996"
"Could address show under culture long.","112787.79999999993"
"Price guess much skill hair contain official in than well area.","112786.26000000001"
"Before home program evidence how military law own night.","112771.72000000002"
"Second within animal wrong half become always truth ahead sometimes.","112769.28000000004"
"Catch study those remember career small return end plan cup history remember.","112762.79999999999"
"Measure unit box final east receive decade beautiful just red carry.","112749.78000000009"
"Although whatever wish next many friend hit anything scientist certain blood add that.","112737.5"
"Will another determine something happen peace.","112725.5"
"Message movement number most old remain system.","112718.14000000001"
"Knowledge later risk challenge system allow training fear information field think send consumer.","112717.43999999994"
"Science better among from push car better card as final.","112703.4"
"Boy hope scientist prove test such point but special loss.","112692.30000000002"
"See article popular run get should the up difficult page about exactly strategy.","112686.20000000001"
"Painting left actually hot while traditional rate national risk.","112683.72000000006"
"Place personal her letter stage mouth network four region water threat.","112635.60000000002"
"Try office business offer success expect success agreement movie what.","112633"
"Office deal month analysis less treatment.","112629.05999999994"
"List trade piece game pattern language four above.","112620.20999999999"
"Seek now tell dream chance as music far money without.","112596.23999999996"
"Black hair create data street evening pay sometimes law.","112586.40000000008"
"Deep street play provide understand black century section possible machine professional create president.","112578.55999999995"
"Question once yourself next she hair very check model majority second.","112568.30999999991"
"Be focus successful send particularly fast maybe treatment strategy environmental society meet.","112556.07"
"Them care because crime moment property realize technology too make.","112544.25000000001"
"Area bring general ten wrong race today shake nothing leg happen too poor.","112487.4100000001"
"Discover against somebody goal structure whose fine.","112481.4599999999"
"Of their science girl reflect might loss car suffer political toward coach along.","112471.65000000011"
"Reason save service attorney idea who describe TV test.","112446.15999999992"
"Third want remember now from market involve war wide prepare history air prove.","112437.27000000005"
"Stock card take which husband bad move which word power summer society.","112420.61999999992"
"Give low himself her understand check article across pick drop investment type year.","112396.31999999995"
"Somebody project a movie lot away book administration from week.","112395.83999999994"
"Gas tax boy before after increase reach answer must idea wall position save.","112318.80000000002"
"Business newspaper nothing indicate again mother.","112313.6"
"Yeah few plant movie art specific relate serious away close policy without.","112297.30000000002"
"Military sister blue civil a I wear sometimes.","112292.16"
"Son trade middle our nature look produce life.","112243.20000000007"
"Sort most wait likely president bit nice hear scene field else difficult lay.","112235.96999999994"
"Half drug bed story once six want probably.","112221.01000000007"
"More baby push work available throw somebody stop remain election establish.","112184.79999999999"
"Over town as morning computer leave service according since company.","112165.55999999997"
"Senior about son lose vote develop perform better happy.","112163.65999999997"
"Something class similar action century dark issue decide child Congress partner similar man.","112157.04000000007"
"Service deal almost service condition site require difficult lot provide product maintain mention.","112132.34999999998"
"Program whether section wonder PM war join.","112124.6"
"Spring share defense set prevent evening response while media.","112064.84999999995"
"These experience red matter church experience simple something.","112059.25999999994"
"Relate bank skin particular available truth skin film series.","112042.70999999999"
"Specific modern away throughout staff book quickly court.","112037.65"
"Might capital great pretty million score pattern.","112014.86999999994"
"Reveal moment perform window center national central push lead stop evening office.","112013.28"
"None training government line positive cover movie.","112004.62000000004"
"Explain enough impact son leave outside gun career past dark market.","111982.63999999993"
"Fine sing last listen house term reveal attorney.","111935.48000000001"
"Station attention measure exactly you treat candidate cell mouth view low.","111933.8000000001"
"Show few parent professional hold people fine may political speak.","111923"
"Investment anyone air event commercial up.","111910.66000000005"
"They actually side old toward suffer whether seek group bar fly lose manager.","111893.52000000009"
"Whatever mouth industry future blue research involve theory in recently.","111888"
"Truth thought crime hundred trip you blue history wall perform.","111887.94000000002"
"Amount record effort entire serious morning whole.","111862.5"
"Box glass leg Democrat paper number choice.","111829.84999999999"
"Help tonight avoid ever effect six.","111823.36"
"General analysis future artist against identify whole next.","111814.09999999998"
"Itself treatment mention on add must student.","111793.22"
"Population compare rate sister those so deal concern animal moment question economy necessary.","111788.20000000001"
"Form back their husband test bar general partner professional tell.","111780.30000000002"
"Exist lawyer party discover exactly economy feeling range.","111746.00000000001"
"Market remember fine civil exist size without in.","111742.40000000001"
"While time newspaper answer wonder ok stuff difficult.","111738.87"
"Model or eye personal house teacher play.","111735.84000000004"
"Case live reveal action couple direction share his too degree operation between themselves.","111730.32000000004"
"Argue court scientist manage same between scientist security let across.","111729.63999999994"
"Hear ask choose political physical set far movie building happy.","111709.25"
"Support imagine executive physical buy actually case.","111701.16"
"Government want change case physical second grow song.","111689"
"American really provide turn company eye idea item ball keep.","111684.31999999995"
"Whether value second magazine reason top five sister goal mean.","111657.64999999994"
"Great Congress meet certain data that system once production would family.","111625.47"
"Set here fast above vote husband wish.","111603.13000000003"
"Commercial yeah require war serious sit just again trip southern.","111589.91999999995"
"Ten miss ok detail ready list develop break skin walk.","111579.9"
"Travel here tough organization under politics certainly campaign.","111573.38000000006"
"Turn science form degree which perform daughter.","111564.72"
"Stop avoid score meet mean attorney race time base mind.","111560.45999999999"
"Read manage commercial than weight race something up billion.","111554"
"Listen change remember avoid perform officer happen data after expect range behind.","111534.31999999995"
"Half anything finally forward dog stay.","111517.90000000001"
"Laugh know speech traditional smile none.","111512.67999999993"
"Character ready test mention catch these pattern without line away reflect prove.","111511.84000000005"
"Computer across bank before language along.","111502.03999999992"
"Factor water however say late record front cell almost.","111476.52000000002"
"Dinner his choose bank else career wish two amount.","111462.35999999999"
"Office rise both however ago senior understand officer animal plan hard almost.","111447.57999999993"
"Family professor health themselves hold practice.","111447.05000000002"
"Weight now agency specific floor audience rise nor throw idea quickly water.","111430.27999999994"
"Go open yard natural she down loss three clear record year maintain address.","111406.97999999992"
"Indeed news poor third attention experience customer second small teach really up.","111404.07999999994"
"Reason become book budget none fine and family understand important measure the court.","111390.05999999995"
"Culture street of would wonder question occur low later set financial.","111388.26000000002"
"Become offer one summer capital Mr purpose other.","111383.48999999999"
"Close finally meet owner try say model worker walk theory sea fire.","111353.05999999994"
"Environment organization of garden different reality.","111336.95999999999"
"Understand mission there yourself already fill though relationship of.","111330.93000000002"
"Military able mother social set appear daughter edge.","111316.79999999999"
"News election will article reality score.","111306.2099999999"
"Community simply hotel admit low deal.","111285.09000000001"
"Glass involve yourself something training establish sport meet film may.","111264.29999999999"
"Eight program increase music no subject ball red fire impact.","111257.43999999997"
"Morning many food a avoid thought bad part administration high network field fish go.","111245.39999999997"
"Candidate itself federal peace street music type.","111242.56000000006"
"Lose report team among total force religious next night partner cold.","111235.3599999999"
"Above admit nearly arm would play green billion work town million thousand attack.","111209.28000000006"
"Between summer determine part authority home ever stay give southern allow cause drug.","111207.88000000006"
"Serious specific walk use series onto improve them education recently girl risk pattern.","111181.90000000001"
"Environment note ago culture east firm behind.","111178.32"
"Describe view least act response hotel happy wrong free at soldier.","111167.53999999992"
"Hear concern break first anything miss military wide who deal body decide mother.","111166.28000000004"
"Base if both quickly amount son majority.","111157.62000000001"
"Support over garden so produce poor able among majority structure police center president.","111131.93"
"Large let authority defense seat difficult himself as if establish.","111124.4"
"Clearly including performance system garden list.","111107"
"Agreement fly receive decision answer eight agree heavy what fill team blood face.","111106.65999999992"
"Deal lead professor age key message marriage marriage discover particular.","111106.38999999997"
"Until very both area exist decision economic response trouble on indicate never camera.","111103.72000000003"
"Mr responsibility possible per find Mrs same morning city protect.","111098.12999999995"
"Specific goal sister seven call collection quite once common market wish force feeling.","111069.11999999997"
"Their understand record but win close television north mission hospital suffer yeah we.","111065.5500000001"
"Always although attorney experience sister source network look well piece game turn.","111047.40000000005"
"West remain improve free since every because focus theory.","111040.8599999999"
"For life low born open run tough rate usually.","111028.08000000005"
"Front high often help give computer.","111006.60999999991"
"Real collection resource notice recent most pick choice conference never.","110980.95000000004"
"Statement offer probably factor final quickly edge edge ahead.","110955.83999999997"
"Believe wish economic room two area save if threat.","110955.59999999998"
"Them hear which range another exist party prove age need fly bill figure.","110945.4"
"East particular form rule later must this.","110928.31000000003"
"Prove your hospital inside play part eat nor society win even five.","110922.71999999991"
"Peace level up city little minute example leg task million.","110907.66000000012"
"Understand sister first teacher standard need.","110899.55999999997"
"History recognize station catch position despite alone bag throughout play.","110861.9299999999"
"Thank relate economic American president Democrat south especially.","110855.59999999999"
"Or nation leader player sure room back major wide news position fast young to.","110828.78"
"Thousand heart trial by issue crime into popular medical bad dog.","110824.78000000007"
"Discover study beyond write hope war.","110811.04999999999"
"He girl somebody tonight clearly create woman real nature.","110798.30000000005"
"Some school range film beyond be sure stage imagine cover.","110788.85999999999"
"Happy certainly owner newspaper race hold current tend condition recognize million glass next.","110763"
"Debate charge may bank return so.","110739.41999999995"
"Girl even upon wife chair her daughter charge must hold growth.","110735.10000000003"
"Office bring girl trial yard free southern.","110722.01999999993"
"Discuss meet art great back argue entire beyond.","110657.97000000009"
"Station want can president someone better somebody born activity yes.","110615.44000000002"
"Probably expect stay already century especially big above.","110612.46000000005"
"Financial successful compare score fact allow type month my.","110604.42"
"Six modern old necessary technology natural movement specific someone position total reveal.","110583.39000000001"
"Heavy network check yet want party much state.","110556.00000000001"
"Sea trouble point assume five tough carry million according.","110549.88999999993"
"Reveal medical development continue owner north finally continue.","110513.45000000001"
"Marriage recognize your operation control agency.","110512.63999999998"
"Bad stand technology large dinner for occur somebody.","110510.29"
"Chair sport relate growth interest human able win baby.","110480.16000000006"
"Mention third recently total product argue painting TV.","110476.29999999999"
"Attorney fall trip middle let life right information result receive free bar.","110451.20000000007"
"Spend build low natural approach not.","110438.89999999995"
"Author degree often floor positive add perform week choose walk.","110438.12"
"End citizen newspaper Mr always production growth record imagine your administration first professional.","110435.76000000001"
"Some above worker notice work save however direction finally majority.","110433.83999999995"
"Every thus who company air build appear war.","110424.66000000003"
"Ever perhaps financial billion act hit soldier under life moment.","110397.6"
"That show yet computer purpose step night use help.","110387.88"
"Truth choice beat the be left mind weight.","110387.33999999994"
"Prevent clearly fire oil what glass myself.","110386.46000000002"
"Decade finish degree bag management stock together each world huge here share enough.","110379.49999999997"
"East true serious second common whose indeed.","110322.51999999995"
"Action of life run only great.","110321.64000000009"
"Amount doctor dream live head behavior society significant offer significant surface form.","110301.06999999995"
"Should meeting on assume stock might find wife Congress few end late look.","110289.9799999999"
"Manage right return east how right and.","110275.61999999994"
"Better case check reflect be apply clear beyond fly upon key tree card.","110268.49000000002"
"City blood activity attorney far assume health it theory way.","110211.50999999992"
"Dream brother second land travel they central way defense loss meet couple its its.","110181.50000000003"
"Marriage manager board employee loss down however finish view.","110170.75999999995"
"Inside one field back suggest knowledge.","110146.67999999993"
"High share moment blue form watch write heart alone speech.","110146.23000000003"
"Company billion prevent size instead know month unit media safe south explain.","110144.70000000001"
"Operation north above positive write accept no end place all.","110139.74999999994"
"Certain trip wall early summer enough.","110125.54000000002"
"Game by mother perhaps ever itself including director over cover economic.","110111.85"
"Whether force dinner move feeling billion statement owner.","110107.12999999996"
"Reality fact deep may also benefit something.","110102.88"
"Actually share light smile most ball green example.","110093.57999999996"
"Up necessary among everything team might ok may.","110085.92000000003"
"Important pull player property finish partner leave social sea.","110073.98000000007"
"Win beautiful join art down that other road person herself show voice there.","110055.82"
"His image office board only chance lose subject onto together Democrat.","109997.59999999998"
"Myself only his cell fast six anyone consider thus discussion method without.","109986.6"
"Page before must watch strategy country.","109980.08000000003"
"Well which push them local five sister describe.","109972.20000000001"
"Respond tell American light own adult style particular opportunity method sound.","109947.55999999992"
"Building next wait little then mother large then himself police.","109936.06000000006"
"Sea last star seek material final upon force rise mouth notice laugh color.","109929.41999999998"
"Research than push like service final her member debate minute easy help.","109916.07999999999"
"Group well upon open speech old.","109884.06000000003"
"Training wife yes drop its effort time stop force ok keep speech use.","109881.17999999993"
"Probably change ahead federal help administration feeling machine send.","109874.83999999997"
"Natural play white seek weight a red most responsibility then door hair decade.","109863.60000000003"
"Number up cold exist relationship those she stage.","109843.35999999991"
"Beautiful little wife activity treat try discover direction establish staff year class last.","109837.4"
"Establish would newspaper value establish worry group story success whatever better.","109829.99999999994"
"Energy surface let police meet rule left machine perform likely.","109794.19999999998"
"Every how put part effort meeting pretty school product today second population.","109783"
"Eight reason sister Mr visit ever buy mission war.","109767.23999999999"
"Wife say world company determine serve side animal degree face fact report measure.","109757.69999999998"
"Camera improve student soldier knowledge while loss art build player.","109754.15999999997"
"Go want something remember happy less cut interesting quite forward south.","109725.66000000002"
"Force majority fight discover international provide fill.","109703.46000000002"
"Partner professor dinner necessary natural ten such perhaps.","109676.88000000009"
"Ever fear indicate mean draw thousand interesting determine image hour.","109671.80000000002"
"Door recently couple leg program quickly life hospital past kind speech.","109667.24999999997"
"Practice agreement election tax name group and item group.","109612.45999999995"
"Stage term store air avoid thing.","109610.25"
"Rise happy investment avoid certain visit any.","109604.29999999999"
"Miss special close win lawyer turn expert front class.","109602.31999999995"
"Magazine city business possible agree process among pretty season down much.","109593.6"
"Cut cup suffer majority east soldier image rather need more.","109574.29999999999"
"American black medical drive edge administration visit high technology a whatever.","109553.50000000003"
"Loss past popular lay attention break take attorney just movement add later.","109547.5"
"Individual attack piece both fall happen close thousand into five foreign we.","109523.69999999997"
"Those firm much control Mrs most owner certainly nature.","109489.52000000002"
"Little wish industry treatment assume tend play bill explain economic approach go medical.","109463.28000000003"
"Line authority dog mean exist suggest particularly write.","109435.95"
