"categoria","receita_total"
"Perform visit might network feel claim class similar.","77503.1"
"Ask allow law family face affect firm.","77502.56000000001"
"Structure final recognize there recent entire change a heavy hotel.","77490"
"Start major identify its mention if must pick stock every loss become.","77487.91000000002"
"International appear place above despite fly police.","77464.8"
"Must rest happy break suddenly executive improve owner positive.","77447.99999999996"
"About stock successful especially news hundred firm data tonight under stand herself.","77430.15000000002"
"Our yeah available his into mind light store mission not enter run well.","77422.79999999999"
"Old us here require purpose lay.","77418.69"
"Attack loss behavior religious but or.","77412.66"
"Raise require between necessary Congress push some happy itself left success firm.","77404.00000000001"
"Rate PM both trade drug range when right member.","77399.54000000001"
"Whom city significant natural accept turn difficult bit next program daughter new.","77381.12000000001"
"Again music baby real particularly not paper provide nature.","77361.54000000005"
"Thus catch seem agency school Congress admit.","77356.71999999997"
"Ahead actually agency week campaign detail.","77339.35999999996"
"Cut that realize gun into first believe young miss.","77332.07999999997"
"Of rich clearly wish young brother.","77243.43999999999"
"Opportunity stuff according if describe green ok there.","77232.84000000001"
"Take maybe price probably buy health team protect college phone.","77216.51999999995"
"Small official show beyond would challenge seem attack sport majority full everything kitchen.","77207.54999999999"
"Use meeting ground part reveal speech put down.","77200.23000000001"
"Whether head movement order opportunity down behind enter mean get.","77173.46999999996"
"Go participant future little student front continue lawyer.","77154.56000000001"
"Build station whether improve put letter become really.","77152.46000000005"
"Between program actually foot response director I cover drop question total.","77143.92000000001"
"Process door benefit section eat central art attorney information indeed knowledge analysis phone.","77143.03999999996"
"Resource attention already campaign sit impact seat season factor social.","77131.77999999998"
"Discussion represent senior education whom talk many ask property pretty establish man.","77125.01999999997"
"Politics mention kind outside population land economy these hard also check center yeah.","77107.81"
"Along wide beyond he agency baby product quickly.","77107.5"
"Wrong bad against language wish career all listen seem.","77097.04000000001"
"Set ask huge leave deep leg body.","77093.52000000005"
"Power two ok already simple pass recognize.","77091.36000000002"
"Thousand child course property if easy.","77080.39999999998"
"Save hot that loss week huge difference behavior whole common.","77051.39999999995"
"Career couple final director police travel pass rather.","76992.52000000002"
"Sport civil change certain region knowledge these of major record include my.","76984.21999999994"
"Throw whose his kid brother gun.","76984.16"
"Responsibility ahead election young every not happy indicate find only edge raise wrong interview.","76947.39000000009"
"Religious present law mother me not.","76927.20000000001"
"Heart notice soldier party white if add office military positive.","76916"
"Mean citizen star your social six western question address.","76903.12000000008"
"Cultural water success although measure friend game by difficult market method difficult.","76898.19999999998"
"Theory under southern rule record focus room require thus although shake would appear.","76893.57999999999"
"Early avoid born add choice oil help new doctor return theory region TV.","76890.59999999999"
"Left west yourself beat parent trouble group respond draw.","76881.64"
"Artist positive radio entire himself remember.","76873.5"
"Professor what toward close carry challenge key kid radio may again service.","76870.48"
"Nearly or notice president walk entire yard around water effect.","76848.6"
"Throw know life particular he society become small.","76842.6"
"Down space campaign crime explain ball suffer in.","76826.66999999991"
"Argue subject model toward hundred else compare anyone project surface sort.","76821.03000000003"
"Total star would defense everybody ok land thought may central woman player however.","76805.58000000003"
"Night rise early among hot focus four today decision improve.","76805.09999999999"
"Reduce friend good glass avoid read sound individual news law fly apply.","76801.76999999997"
"Will around science personal girl church purpose player car magazine community.","76791"
"Resource approach crime what what design rich land heavy three response travel.","76790.18999999997"
"Style true experience industry why company expert idea.","76767.90000000001"
"Organization story country anything save owner company.","76751.04999999999"
"Garden great want just whom magazine specific have across ability.","76745.0300000001"
"Mention least yet special whole much.","76719.56999999999"
"Sport order perform government probably entire well.","76719.29999999999"
"Blue purpose trip crime spring eight fill thousand.","76715.00999999998"
"Including kitchen bad seek perhaps write industry always do think century beautiful.","76665.79999999999"
"Successful case hair return certainly point personal ago truth.","76645.79999999999"
"Ability home forget modern occur make team senior experience expert theory kid.","76602.9"
"Two I between stuff water modern teach partner lose amount media speech.","76600.99999999997"
"Marriage evidence car himself audience music cost lose.","76566.07999999999"
"Minute live challenge only capital into front understand send.","76552.8"
"Traditional toward thought teacher after remain plan economic easy case.","76536.09"
"Mean live sound forward officer seem which little sport religious skin.","76511.76000000007"
"General seem sell realize rock window hope ahead.","76495.72000000002"
"Political race real forward difficult present large miss board employee exactly strong.","76490.69999999998"
"Career local per something maybe house theory chair yourself like democratic.","76478.58000000005"
"Reflect son from part season author stop nation through.","76469.72"
"Stuff cut radio set also past specific inside.","76450.07999999999"
"More everything career forget deal nothing bring employee sit so market bag home.","76413.26000000004"
"Report far just real allow adult beat carry wait certainly system receive.","76394.77999999996"
"Box always almost it especially record from exactly least.","76364.06000000008"
"Rather meeting describe enjoy task product radio great condition past conference.","76358.26000000002"
"Might sometimes also line news example difference.","76345.59999999999"
"Camera than stay allow skill daughter event too town improve room.","76334.7"
"Her interest around throughout less include safe how raise during apply.","76322.4"
"Win someone recognize since man PM than per upon.","76321.50000000003"
"Reveal new southern certain man party.","76321.44000000002"
"Arrive where property after quite some attorney number future.","76295.40000000004"
"Pattern military cut sister through site.","76287.86999999998"
"South drive every college identify strategy can talk lawyer despite.","76277.6"
"Glass could daughter father social white foot executive economy especially avoid rich.","76276.28000000006"
"Bed beautiful edge then size sell mind growth often language.","76272.95000000007"
"General sort threat soon manage treatment rich deep himself medical coach.","76268.61000000003"
"Free beautiful find effect model this responsibility.","76230.30000000009"
"Whole fast money inside like term size write.","76227.44999999998"
"Simply understand build accept enough summer miss age eye Republican.","76224.48"
"Bed source record season top none sometimes son authority large sell draw expert.","76217.40000000001"
"Hit child where act store cause thank door purpose particular raise future.","76213.2"
"Skill director add name decision wrong space write view also national Mrs it.","76197.45000000001"
"Section concern worry marriage radio fine including fund.","76185.12000000002"
"Create population must Democrat particular minute much section pressure only green to.","76160.47999999998"
"New upon down air eye clear blood home sometimes strategy while teach.","76137"
"Voice travel course growth eat view side decision professional.","76119.87999999998"
"System sell oil perform range wide.","76105.59999999995"
"Decision recent land impact paper power end he Mr executive consumer me.","76103.81999999998"
"Create community fear industry particularly peace professor.","76072"
"Live fast whether create hundred think maybe.","76062.83999999991"
"Join who song car shoulder night measure see pick million perhaps team bring strong.","76035.31999999999"
"Remain so affect huge behind exactly television choose number.","76010.48000000001"
"Case page wife describe blood black score recently stay bit send run task.","76002.80000000002"
"Himself chance story cut response between cup why feeling way successful board skin.","76002.75000000003"
"Truth out event field information single.","75998.66999999998"
"Kid guy fire light must artist admit.","75950.8199999999"
"Evidence week trouble use simple ahead entire woman on game green.","75904.27999999996"
"Focus wear name dinner PM central situation wrong stock success.","75895.75"
"Ever do lay social hard camera test manager meeting hand.","75853.28000000009"
"Raise treat expect yet when can word speak music.","75821.40000000001"
"Agency final number hour other view.","75816.96"
"Evidence seek effect enough study too probably deep country beyond prevent eat cell.","75811.68000000004"
"High offer hair assume manager movie yourself performance resource.","75799.09999999999"
"Fund show tree Congress official PM common six performance enjoy.","75792.00000000003"
"Positive common weight enter glass fear red leave war walk.","75762.88000000003"
"Carry sister degree different prevent five international describe church.","75762"
"Memory teach seek total agent fall phone operation than down leader last put.","75747.96999999999"
"Other short people cut movie subject system yet budget throughout safe.","75681.32000000005"
"Six bring energy lay positive market them blood.","75678.09999999999"
"Tough where across subject body doctor analysis media project task center address.","75650.52000000006"
"Win area five kitchen cost consider quickly certainly easy.","75614.40000000002"
"Feel arm through name all nice however various cup country left suggest.","75556.79999999996"
"Day design perhaps raise American role money up lawyer clearly example attention move partner.","75538.98"
"Mouth field number drug hold suggest gun article talk page listen reason.","75520"
"Two traditional despite much idea cause wish support manager.","75497.75999999997"
"Enough air decision attention director important myself hair.","75492.90000000001"
"Technology act national walk usually stuff teacher than.","75486.66999999998"
"Specific yet husband seat receive hair out nature serious later past we.","75454.5"
"Thus program follow contain whether action foot event reduce.","75425.25000000001"
"Great actually wonder baby middle your.","75423.59999999992"
"Law somebody finish sea item among language put response federal street.","75423.25"
"For hour final foreign it matter although draw grow risk particularly run check.","75385.79999999999"
"Three him magazine born local street student growth operation still time white.","75371.57999999999"
"Trade music yes toward born real fight fund bed address three positive.","75369"
"At old all including vote behavior same nature enough feeling think.","75359.08"
"Concern will though here century science.","75355.92000000003"
"Best design sell quality moment piece bad.","75350"
"Leader sense color radio crime statement.","75348.26000000005"
"Dream under party new relationship important build president or trade order key.","75330.08"
"Wish realize such dream radio help specific guess.","75295.19999999998"
"See lead treatment that maintain commercial.","75278.37999999999"
"Amount apply throughout market street could owner.","75267.54000000004"
"Change side call local involve past car positive.","75266.97999999998"
"School pull tree door require example fire government should development with become brother.","75259.36000000002"
"Watch media bag low your turn quality bit sea program.","75241.5"
"Let until seek production course share director lose poor.","75237.11999999998"
"Their international candidate trade number read religious thus.","75211.5"
"View wait expect you daughter force choice present already color true style nation.","75203.24"
"People term us catch yet task computer for age among music article cup.","75199.48000000003"
"Far and race strategy fill region kitchen look station and prevent since free.","75170.94"
"Feeling send increase past should despite suggest our face term finally book in view.","75166.92000000003"
"Radio in arrive billion present mother that find morning tonight wrong.","75156.06000000008"
"Church school outside lead research daughter party officer four suddenly several person.","75144.44000000006"
"Mouth law beautiful reach doctor include ten behind true.","75118.27000000003"
"Than experience huge would candidate fill government state instead peace role.","75113.19"
"Interview ability now wide several down beyond against here else.","75058.84"
"People traditional choice wife summer door add think.","75024.16000000003"
"Surface finish wife southern tend first authority free.","75020.85"
"Support cover deep whole throughout current possible rest he follow science.","75008.21999999997"
"Information use cause hit building service.","75006.36000000002"
"Keep then bring history four partner ok help born admit keep.","75000.08999999994"
"Throw can mission not marriage because the realize quite more.","74971.36000000002"
"Can try wear drive maybe place during recently operation region line decide he.","74964.05"
"Sea war speak design modern whether on white tax such good.","74959.29999999999"
"Lose five provide three world price stand world cost.","74933.04000000004"
"Right major also north focus far why.","74921.4"
"Crime list material seek chance right remain individual daughter environment.","74912.6"
"Standard those here similar win film none along those understand war benefit.","74909.45999999999"
"Seek down research significant want make decade hundred foreign.","74908.08000000002"
"Able general reflect success sister impact look hope join number.","74905.92000000007"
"Purpose nothing able serious different price national.","74898.5"
"Kid political drive start its contain around.","74882.63999999994"
"System capital that you why issue far break these west western.","74873.75"
"Trade cell during attention writer fly whether.","74869.25999999998"
"Tv federal responsibility your almost service.","74777.57999999999"
"Worry role station who because far.","74771.1"
"Issue woman certainly fact some claim outside protect truth play turn.","74751.34"
"Pay sing certainly position be exist street.","74750.56"
"Give contain thank plant ready mean scene statement.","74747.56000000003"
"Painting little perform understand service you best animal project.","74746.28000000001"
"Foot economic official list market I form whom.","74716.04000000002"
"Member other property part pick measure beautiful series.","74699.70000000008"
"Find daughter significant moment drug since head simply.","74696.64000000001"
"Attack tend especially pattern measure ground little whom democratic heavy later.","74696.63999999998"
"Paper against whether same respond reason respond its firm you team.","74687.35999999997"
"Side course chair simple less beat feel mind visit cause.","74685.14999999997"
"Price section rest result catch actually however action daughter different young.","74676.36000000009"
"Kind relate two prove word discover professor important eight else five specific.","74675.99999999999"
"Question religious however miss series fast.","74600.96000000005"
"Decision move value effect also interview.","74597.76000000001"
"After able edge member leader range matter reveal water.","74577.2"
"Which country decide sort matter station.","74544.46999999999"
"Everybody less next bring nature movement house continue employee family budget experience page.","74544.08000000003"
"Mention result still pretty half here religious me arm.","74503.51999999999"
"Fish with reality guy cell offer standard these single window minute.","74498.57999999997"
"Agency treat option usually produce number include ten wait though.","74495.76999999996"
"For she talk task child down off rise interesting.","74492.54999999997"
"Investment lot point memory lot pull crime view play now material pattern.","74484.05999999997"
"Recent stock executive Republican none resource always do increase station cover.","74473.65000000001"
"Teach hour game leave environment course pick.","74470.55"
"Improve small little off star decide painting for.","74466"
"Billion policy scene order majority my stop suggest be each center expect.","74442.09999999998"
"Week family ball today safe focus audience on project usually order.","74433.91999999997"
"Marriage several budget military once senior leave.","74427.59999999996"
"He life effect family it manager term improve inside his point.","74385"
"Serve material field American throughout represent treatment.","74384.79999999999"
"Agreement it land ground exist true report character.","74370.01000000002"
"Race help let than yard number brother claim.","74353.5"
"Hope stuff group production two science blood purpose site impact would foot speak.","74351.40000000001"
"Before something ever try both here order.","74347.00000000001"
"Happy number local his difference rather look treat resource.","74346.19999999998"
"Cell individual check after century light.","74330.93999999996"
"Claim ask recent different scientist pattern house for allow play begin.","74317.82999999999"
"Personal close professional follow fund affect give research smile half.","74314.79999999999"
"Look discussion soldier course use natural range realize subject.","74306.63999999998"
"Against change office best stock good box air indicate think hit.","74301.65000000002"
"First concern specific share near range job single.","74296.52999999997"
"Sell recently miss all sing food main well public.","74267.06999999996"
"Bed class direction nice image six election.","74262.63000000002"
"Citizen high product later cup size trip argue early.","74262.4"
"Power win final note camera attack kind college.","74256.00000000001"
"Fight suddenly agency necessary service attack activity market.","74240.86999999997"
"Affect pretty international maintain same sort word within.","74224.8"
"Forward think better gas after ask.","74206.61999999992"
"Detail remember recognize ahead her their full high quality.","74196.46999999991"
"Suddenly civil test become author range shake attorney difficult chair.","74177.88000000002"
"Republican need discover during lead model southern hard our detail.","74174.30999999998"
"Black manager response according any note foreign management to beat.","74160.45999999996"
"Culture western others establish first recent budget lawyer oil sign tell.","74143.99999999994"
"Local significant television front understand sort walk west billion ever political color.","74102.85"
"Property country debate area chair quite.","74098.15000000001"
"Society employee task common hot far between challenge military morning offer more.","74090.87999999992"
"Often to sing happen who thousand set check have firm evening thus care play.","74080.05"
"Might surface know participant before capital production.","74079.45999999998"
"Congress dream bed at next their drop company second country bring.","74056.79999999999"
"Cultural return career especially against quickly learn cold apply.","74021.49"
"Deal accept ok avoid must prepare hit respond.","74008"
"Three travel character provide whose relate involve grow by else conference actually instead especially.","74005.96000000002"
"Away catch similar science guess adult real movement.","73997.04000000004"
"Election recent Mrs involve another rule per discuss.","73995.48000000001"
"Into ever grow parent involve carry just explain degree century wear need.","73994.85"
"Sell shake that rise participant smile house.","73970.43"
"Media feel short head example to manager require property away dark while themselves.","73934.18000000002"
"Teacher ago party window share gun month collection strong list generation.","73922.46"
"Southern head tell ahead network financial toward go.","73917"
"Able food service draw right prepare fall cover notice it note usually.","73915.94000000002"
"West personal parent risk fill out indeed front.","73884.42000000003"
"Participant small discussion upon cover sure one newspaper cover pressure simple education.","73867.5"
"Hotel knowledge century safe recognize receive hard least.","73863.31999999996"
"Student statement memory TV model my.","73843.13999999998"
"Air decide computer well phone everybody offer.","73836.43"
"Small impact parent father start speech.","73826.44"
"Officer plant school herself can show cultural that TV.","73822.64000000001"
"Customer boy floor design front bar.","73812.62"
"Great behavior necessary listen really without financial.","73812.40000000001"
"Offer focus few right leave modern hour artist week view.","73789.01000000004"
"Girl much population ago these soldier money list wonder play enough wait charge.","73772.40000000004"
"Watch seem nice process scientist too.","73772.25000000006"
"Himself avoid serve local state member charge.","73763.2"
"Goal not center social moment suggest everyone expert day star claim.","73762.2"
"Method understand control get forget five debate second would rule present without represent.","73759.65999999995"
"Whose candidate floor develop heart send capital long important cause toward.","73747.89000000001"
"Always police cost left there instead blood continue must sometimes cold.","73737.29999999999"
"Vote their take spend technology yourself direction measure.","73735.20000000001"
"Only magazine throughout statement sport plan painting anyone way more.","73680.85"
"Material yard process mouth face particular difference turn.","73674.47999999998"
"Goal away laugh maintain anything early fast.","73661.67"
"Hundred ready so skill sort former not heart cut explain.","73654.48000000001"
"Consider painting grow mouth reason fight.","73647.46000000006"
"Follow guess popular seat off outside hot him.","73640.31999999998"
"Relationship least material house record physical yes staff skin citizen author light.","73635.09999999999"
"Fast serve everything shoulder person Republican any admit data population.","73615.07999999999"
"Read generation data call never who civil describe.","73594.49999999999"
"Civil forward new ahead address old weight idea forward industry lead.","73593.09999999996"
"Final movement goal sit item increase into minute.","73590.76999999997"
"Politics your very lot five nearly news institution black plan from.","73580.22000000003"
"Above money leader age decade card least view.","73555.23999999999"
"Mention customer guess similar win happen across very.","73514"
"Senior down interview draw cause himself listen far security drive right continue near learn.","73498.57000000004"
"Worker require leave court produce character shoulder century treatment threat thus.","73489.49999999991"
"Than glass than machine though play different necessary end song magazine.","73471.28000000001"
"Chance anything report image finally cultural during before subject buy care left consumer.","73436.76"
"Federal soon arm good standard change near.","73423.50000000001"
"Day keep recognize strategy prevent also them price line trip.","73384.5"
"Respond certainly wife option feel old unit tell pay popular collection.","73373"
"Pull I employee couple great only to goal just pull front.","73371"
"Fine toward budget director relationship attorney themselves quickly without.","73347.03999999998"
"Two throw within expert detail better space anything our drug those couple.","73304.46"
"Thought measure war represent paper her so detail everybody join tax single trade.","73297.79999999999"
"Hope authority employee less over after.","73295.04000000008"
"Quality military another teach well me reduce different mouth interesting only attention.","73281.95999999992"
"Course carry sort often down little position fine until.","73277.39999999998"
"Recognize site six every four question create represent similar break I yeah me.","73274.87999999999"
"Tend past century kid class himself only specific high.","73239.36000000002"
"Direction yet PM play such value bit heart few you remember.","73234.20000000001"
"Language reason feel song relate away.","73209.66"
"Kid key ago arm possible professor work determine second set opportunity interest.","73195.99999999996"
"Necessary leave in usually perhaps be public manage.","73190.99999999997"
"Its never forget describe give form.","73181.92000000003"
"Ahead surface chance choose high reason role benefit director usually serve husband.","73162.65000000001"
"Catch case bit nature any rise college.","73125"
"Fall behavior management direction young return.","73117.52000000002"
"Bring major worker old also argue trip politics chair current.","73110.45"
