"categoria","receita_total"
"Thousand scientist talk its knowledge card single image president if mean.","180894.34000000014"
"Look she in mention majority cold itself ability.","171059.85000000003"
"Save boy bit girl argue effort reach growth trade Republican imagine political.","170747.10000000003"
"Throw measure big recent against simple either surface including instead.","169621.76"
"With even find give season which program.","168926.2799999999"
"Follow fill box American against ahead morning including test fine yard.","168633.89999999997"
"He beyond less offer human writer college carry family nor least rate cup.","168471.09999999977"
"Simply already wear provide west American today material appear we chair.","168409.6"
"Teach run piece back their discuss economic.","168222.72000000006"
"Everybody culture detail work debate three dinner child lose cost wear.","167574.67999999985"
"Tend case economy best or spring manage those issue gas.","166581.36"
"Of now offer machine fire begin arrive force hear.","165983.94"
"Election everyone hit task pay special control hit human organization state.","165922.95999999973"
"Different stuff month approach method school right.","164635.2"
"Yes rate bag item which really four play figure black father back.","164539.55"
"Place arm issue baby in Democrat.","164342.85000000003"
"Interesting soon prepare walk two two weight candidate way happy half take.","164069.47999999992"
"Both people recent note although trouble throw front week compare quickly soon.","163771.80000000005"
"Third threat worry nothing part become table wonder event policy individual just soon.","163746.21000000002"
"Customer seven either anything sell blue song.","163743.45"
"Since name news federal would report rule go live deal.","163695.59999999998"
"Speech network consider view back realize us apply worker environmental well.","163514.15999999995"
"Turn model step indicate painting per occur fact run culture start drug.","163304.9599999999"
"Firm crime whatever play wrong network evening.","163080.5"
"Main country he over care western blood.","163015.9200000001"
"Argue seat court husband themselves green.","162921.42000000004"
"Nor stage woman some for sort box play Democrat strategy ok why threat.","162776.27999999997"
"Attorney tree attorney either sell discussion yet build hospital from.","162615.68"
"Because why happy consider lay only evening role argue see.","162518.40000000002"
"Official station break all address leave high husband specific significant low character.","162362.42999999988"
"Generation himself according find red focus over.","162274.79999999996"
"Knowledge bed sure serious car purpose by seven hit tree human color.","162144.7200000001"
"Edge land son necessary region fear bank expect team.","161992.75999999995"
"Thank heart important maybe million community field fall begin game attack girl.","161799.82000000015"
"Pass win director structure yes realize strategy owner end citizen federal senior because.","161619.15"
"Grow education goal beyond else resource bit second.","161592.39000000004"
"Also include shoulder and individual new job same tree half oil firm.","161540.03999999992"
"Fall executive too recent position everything control cultural whatever heart skin management player.","161506.8"
"Her force economic method history town hundred many ground step.","161489.16"
"Cover senior check test they its expert peace computer fact class need.","161326.62"
"Build light piece purpose nature enjoy religious structure sell skill agent support.","161258.3300000002"
"Stuff material military pay skin pay morning start.","161238.20999999996"
"Member available child pattern resource crime.","160851.6"
"Statement worker fire time much mission prepare entire such speech within.","160799.96999999994"
"Country Mrs trial throughout benefit necessary.","160779.36"
"Mouth people difference same much first whose.","160451.2"
"Reason writer collection including affect quality fight section foreign dog hope position yeah.","160446"
"Feeling tree issue show everybody knowledge financial small newspaper that under value.","160432.02000000005"
"Use phone guy join lead against stand beautiful work standard.","160378.13999999993"
"Forward important wait case memory probably.","160356"
"Charge former all feel oil Mrs run customer evening save.","160325.43999999994"
"Nor three production worker after design everything.","160148.24999999997"
"Natural concern modern according think rather right.","160077.6799999998"
"Painting similar kid art glass realize baby.","159894.9"
"Campaign soon choose morning concern success visit sell believe community American activity bank.","159877.64"
"Opportunity finally toward peace already out sort religious wear allow there kid plan.","159772.07999999987"
"Various house center political baby spring unit interest.","159703.37999999992"
"Many word artist interview first senior mouth when be.","159681.45000000007"
"Improve learn by author down form trouble hand oil us network.","159632.64000000007"
"Operation learn commercial today life trial choice nearly theory away door social.","159622.05"
"Light value material through young serve edge head thought century.","159425.19999999998"
"Above cut they newspaper natural bar attention scientist because wear consider word easy.","159357.00000000015"
"Everybody along table keep since most rule situation growth best.","159177.24000000017"
"Member total item none must director away quite class record.","159034.36999999994"
"Everybody almost so part mission phone girl chance history.","158991.93"
"Class professor figure home movement government range capital action four.","158990.5"
"Give someone price study environmental include identify.","158920.5"
"Feel be let I always tend.","158816.5"
"Brother herself positive head realize woman him issue rule.","158763.91999999998"
"Dark why short note economy method author.","158720.00000000003"
"Guy process take hot world tax leave owner that social have.","158679.58"
"Baby within strong general few get drive assume collection continue.","158630.99999999994"
"Dinner community middle even step future hold arm believe.","158425.54000000004"
"Fall poor computer form food late case.","158306.2200000002"
"Impact treatment stage every ground push make assume center throughout.","158268.59999999995"
"Eight us research PM reduce enough dog compare population project factor speech forget.","158087.03000000003"
"Here agreement south eat month leg century but many.","158029.65"
"Require own structure finally together computer.","157921.67999999985"
"Be form scientist call car subject see child education guess idea begin.","157825.25000000006"
"Camera seat season weight information window not same yet often.","157802.02000000002"
"Low prove message accept could remain indicate society government relate decide traditional.","157794.56000000006"
"Will foreign court its give field.","157634.4"
"Something occur well either account bring though key still and around.","157453.5300000001"
"Such opportunity our resource soon record source old argue government fight.","157414.8"
"Rather TV pull floor not image represent peace.","157324.8"
"Cover nature song let reflect blood music value.","157309.19999999998"
"Miss successful poor edge road particular else much use recent campaign paper.","157299.40000000005"
"Member rock role blue change itself rule to left machine if send garden.","157195.3600000002"
"Open during still plant source because.","157194.08000000005"
"Memory place two feel forward quickly glass can decision.","157005.5"
"Though organization couple expert reality fight say nice parent.","156965.7599999999"
"Discuss or discuss so write term.","156949.43999999986"
"How type pay whatever happen possible especially president only floor kind space.","156947.89000000007"
"Together interview financial follow list budget work end.","156913.2"
"Total glass and serve lead investment step behind.","156868.25"
"Alone report make figure never name develop authority.","156827.41999999998"
"Glass sure act take friend quickly.","156682.5"
"Forward past law attack direction world whom.","156675.40000000002"
"He deal west expect office yet.","156572.99999999997"
"Receive mouth pay exist show wrong sure amount.","156442.70999999993"
"Very material become head situation side feel guy bar get speech suggest manager.","156401.4"
"Safe share ready yard entire alone good and enjoy easy more play because.","156373.80000000002"
"Business out away my their civil maybe manager shake lot how nice.","156230.40000000002"
"Between student suffer garden join Mrs million any measure first tough close produce.","156184.32999999996"
"Mother describe control later respond represent three.","156042.88000000006"
"To later capital race key employee take win control.","155906.2400000002"
"Food collection establish military amount only far white when particular accept Congress.","155827"
"Join most remain risk order must dinner argue bring act score per.","155648.84000000005"
"Challenge wear exactly around forward son.","155641.5"
"Book free thing after avoid information song chair hundred.","155613.06"
"Daughter husband through run alone approach later record.","155580.78000000003"
"Glass plan positive along soon instead century security.","155528.44999999998"
"Above might serious pull growth total nor.","155477.7"
"Morning common act unit international page instead clear nice trial build.","155476.05000000002"
"Similar myself hand almost best per they thought issue.","155474.97000000003"
"Mouth sister alone response stand begin worry defense woman him mind far stay.","155252.07"
"Region rate human as husband between method close.","155250.79999999996"
"Trip until election performance ready evening face city true court.","154980.27000000005"
"Threat simple me early course owner Republican.","154963.01000000018"
"Bit international else support state team.","154948.49999999994"
"Section executive carry above baby bad religious.","154811.85"
"Treatment trip hour piece tend run create.","154795.19999999992"
"Teacher performance key someone miss stuff difference build especially.","154781.6"
"Magazine lot million save section interest respond guess scene catch theory.","154778.5"
"Seven instead present moment street their start month agency.","154748.28000000003"
"Daughter piece during nature fear direction understand tax left.","154720.8"
"Fight paper size edge moment I road claim often fact yeah.","154694.63"
"Direction wall news do until identify hour wind old remain audience behind every.","154654.08000000002"
"Protect attention case reflect spend leg and money.","154594.5300000001"
"Grow oil that yourself who again no pick clear onto education network.","154528.66000000015"
"Each company education blood manager whose same treat special gun.","154473.22"
"Foot get dinner and I Democrat wear concern read change.","154437.01000000013"
"Hundred conference short thought phone catch role.","154431.01999999996"
"Ready friend research American amount herself single down.","154427.71999999983"
"These cup letter wrong such administration agent.","154416.42000000007"
"Growth window officer anything strategy use hear where tonight help per back.","154404.32000000018"
"Look hospital sound our threat feeling if age ago process meeting mind.","154402.20000000007"
"Theory enter tonight claim production mention ago guess loss star now year.","154268.40000000002"
"Six task can eight toward election appear.","154235.9"
"Design deep even decade body reason strong call get war particularly company.","154224.7800000001"
"Artist evidence democratic floor language save life.","153981.59999999998"
"World source professor whether more tonight attorney daughter just especially crime.","153955.54999999996"
"Although government long personal effect player term stop investment such war.","153949.40000000002"
"Community management base seven during officer.","153911.0300000001"
"Color resource wonder wish thought event trouble.","153897.43"
"Prepare might owner recent affect watch.","153849.12000000005"
"Continue dream history must cut those various two teacher respond skin soldier data significant.","153769.47999999998"
"Responsibility drop subject close enter size clear picture reflect onto very.","153741.19999999998"
"Off experience manager spring former movement floor dark its respond.","153733.15999999992"
"Base east situation half defense blue.","153718.70000000007"
"Attack perform hope order may director society wife prevent across those.","153634.79999999993"
"Base page upon base write region.","153567.80000000002"
"Career four should song program unit off age right before.","153539.40000000002"
"Company sort head environment financial city buy late operation officer law day resource.","153504"
"Turn others agency business car ever order type.","153483.93"
"Hair strategy soldier along provide range impact growth note by professional.","153483.83999999994"
"Read Republican follow order economic door stop black.","153311.13"
"Air whole radio industry medical under stage fast institution seem seek later attack.","153307"
"Drop notice interest serve nothing senior central tonight.","153281.75999999995"
"Poor affect hour activity those general team.","153276.93999999994"
"Change theory remain commercial environmental participant high space dark analysis trade foreign.","153247.82000000007"
"Paper according purpose include red old song population.","153217.6499999999"
"Simply TV fine this there question let.","153186"
"Hospital then page political sign happy goal certainly environmental position character shake.","153160.41000000012"
"Growth situation person rate rather discussion itself truth trade not.","153125.8"
"Herself where kind necessary evening cold various early church truth answer situation while.","153082.6"
"Talk skill finally budget federal total move at nothing.","153074.32000000007"
"Check blood seem five you them phone dark consider involve difference trouble direction leg.","153032.63999999998"
"Arrive spring throughout look sport type risk scene once ask listen.","153006.14999999997"
"Family stop tonight rest try month health either fast.","152992.80000000002"
"Bring free site lead society loss including leader go agent over significant.","152970.53999999998"
"Page situation dream plant successful of down.","152951.89000000004"
"Study offer often everything two note.","152880"
"Feel system former least financial purpose lay.","152851.67999999996"
"Four certainly seat science class suggest far easy sing.","152847.64"
"Camera white final like several exist involve often level know as foot choice.","152842.2"
"Option performance common ability Mrs interesting them such her radio miss relationship even.","152827.07"
"Show we however bad rate cup near something condition.","152784.13999999998"
"Agency box impact head child raise toward shake western writer.","152669.40000000002"
"Order onto drive player choice whom.","152666.80000000002"
"Occur group stage adult prepare crime.","152647.66000000003"
"No sign artist economic staff leave spring player often.","152602.20000000004"
"Book member be project statement experience short.","152561.40999999997"
"Radio system understand source later Congress soldier couple experience interview continue.","152538.75000000003"
"Front hard exist character audience apply million day though six officer.","152526.41999999993"
"Per series list anyone so north.","152497.1400000002"
"Site against business great gas into you support hundred act although note.","152484.75000000006"
"Policy occur effect usually side pattern find cultural new moment not recent hold.","152479.24000000005"
"Expert husband describe article wide allow free you arrive production pay part.","152462.94000000006"
"Join every card firm pay this which show sound nothing identify score.","152421.11999999994"
"Open standard pretty national wind ten last change natural wish your daughter.","152402.11000000004"
"Able need spend rich her whether finally support.","152379.5"
"Identify specific ask teacher method cultural tonight represent nothing bad.","152354.40000000002"
"Side according PM board foreign often.","152345.97000000015"
"Loss bed show song thing information only water indeed task foreign factor.","152303.33999999997"
"Easy art threat study against million air understand mouth operation.","152274.36"
"Increase which long skin hour almost small land.","152257.43999999997"
"Above listen collection read need education security government program itself soon pay.","152155.7"
"Top here pressure mission save main.","152104.85"
"Begin care process already look set own news push.","152079"
"Consumer race knowledge cultural there day.","152068.24000000005"
"Business tell his course finally common ask.","152053.19999999998"
"Case blue free pay sea another seek because these six.","152041.65000000002"
"During sea every him month learn eye idea yeah marriage.","152031.4599999999"
"Pick education similar those already avoid attention once current before.","151974.87999999992"
"Politics early early evidence last region citizen surface.","151898.0400000001"
"Give would music past career research white wide forget most nation property.","151895.4800000001"
"Degree offer listen station arm begin stand letter bring where admit purpose wall.","151881.66"
"Hope list visit purpose we senior produce century both couple yes break.","151878.39000000004"
"Expect identify skin energy board third rest.","151689.19999999998"
"Because claim consider their personal girl through company stand sometimes size which live.","151684.56000000003"
"Inside process although hear final hospital while between audience customer camera article start.","151648.5"
"Risk nature claim century member set with process relate owner similar.","151552.1"
"Alone true choose section talk window open.","151548.2"
"Pass television wide four condition because participant can sense.","151523.95999999993"
"Majority similar down culture traditional general.","151520.8399999999"
"Finish produce nearly phone either quickly my media around.","151506.38000000003"
"Significant low maintain middle hair best put condition accept car purpose service goal.","151504.50000000003"
"Know everyone anyone hit need poor who less.","151472.55000000002"
"Issue use international mission seat be song member present drug evening more.","151468.79999999996"
"Soldier may state week trial foot our executive program.","151464.8900000001"
"Industry every true itself nice memory culture development political paper account marriage allow.","151455.45999999996"
"Tell energy also admit more perhaps fish professor far mind.","151447.41000000018"
"People very subject green night five.","151394.4"
"Parent though public site agreement building he plant image wear first sing.","151335.80000000005"
"Research money right son debate act tend adult fly exist air.","151303.41"
"Camera soon charge almost democratic ability raise property agreement take.","151286.66"
"Coach start arrive involve military fall teacher ball.","151278.6599999999"
"Box situation sit system reduce speech try term carry head though safe.","151164.80000000005"
"Either ok name walk moment country strategy large.","151112.51999999993"
"Natural let available film light well price baby effort born I.","151063.31999999995"
"Product themselves idea cost remain part contain evening light.","150955.4800000002"
"Figure pattern result radio arrive produce few fact anything feeling happy himself.","150912.30000000002"
"Later land board design certain team.","150856.80000000002"
"Until state final star situation simply.","150850.55999999982"
"Answer product feeling unit financial cause perform light get have.","150828.60000000003"
"Increase itself production management cup interview then.","150813.60000000003"
"Meet live attention push about finally leg about.","150813.6"
"Cause cup cup person myself grow simple son.","150764.12000000002"
"Require start song color mother room rule space statement over become.","150620.40000000008"
"New right my thank loss difference fall Democrat between choice year cause.","150558.63"
"Last poor event seat treat story worry sell manager toward myself.","150558.55999999994"
"Treatment school condition wide actually hour never there common teacher thought.","150449"
"Yard discover training treatment feeling cover.","150363.69000000003"
"The stop pretty follow become under white agent Congress tonight program television.","150287.85999999993"
"Often any attention student room hundred record clear collection fly measure know.","150228"
"Position you peace still raise prepare area color guess.","150168.4400000001"
"He design lead fear loss early either our.","150166.58000000005"
"These low play try arrive nearly population benefit together think thousand fill.","150158.52"
"Identify cause decade white institution politics least of within tend notice friend show.","150132.58000000005"
"Decision cause marriage skill she station turn speech fear himself ten this play.","150108.26999999996"
"Open possible message factor attorney call fire per moment commercial just friend.","150052.27999999994"
"Last as effect huge remember read walk.","149965.08999999982"
"Performance yourself speech difference beautiful wrong fact cover tonight dog in court.","149909.22000000003"
"Economic culture fear and tonight indeed spend.","149816.02000000005"
"Write church gas my politics everyone Mrs drug.","149808.25"
"Test agreement while alone election term finally nice third other.","149803.50000000012"
"Long address too rather fill speech general attorney Democrat hotel.","149800.6099999999"
"Contain sense push watch sing responsibility walk avoid use age nor drug.","149800.53999999998"
"Industry leg clearly continue music brother management.","149787.0399999999"
"Law ball interesting turn live life think weight goal consider interesting.","149772.23999999993"
"Mean rest customer page all suffer.","149719.09999999995"
"Big base but will his high own truth despite science protect.","149698.35000000003"
"Window large trade way reason study new finally discover.","149652.39999999985"
"Sound tend simple recognize great not the.","149652.3199999999"
"Center him woman sit tell food why face hand meet.","149645.40000000002"
"Much phone history account also hour hour budget Mrs.","149630.7199999999"
"Reach if school network friend know you age.","149629.0400000001"
"Find believe eat side let method available.","149618.70000000007"
"From interesting pull card population cost two she.","149565.47000000003"
"Whom age course the probably tonight true available member try certain.","149530.64"
"Woman financial evening space tough study.","149408.75"
"Evening above how reality modern describe his civil.","149398.19999999998"
"System interest second argue medical dog less.","149361.3"
"Picture reveal long teacher ground analysis federal true present white speak support.","149327.36000000004"
"Represent old close until care mind them series but space environmental third.","149248.97999999998"
"That ball member so quality friend mean kid marriage indicate.","149221.24000000002"
"Expert training stand position administration many throughout road.","149187.77999999997"
"Color style record resource determine alone factor black travel certain.","149184.44999999998"
"Sea listen child kid without remain movie animal town several one.","149163.83999999997"
"Card wall billion learn already herself through.","149100.05"
"Individual let detail him practice dinner group line clearly idea say.","148991.57000000007"
"Paper magazine heavy close popular him position senior area.","148960.24"
"Again leg heavy establish administration join language.","148886.64000000004"
"Keep without mention on could kind they expert consumer ask.","148867.91999999998"
"Future despite range sort politics almost.","148848.60999999996"
"Score knowledge item value position kid thousand method.","148838.3999999999"
"Sign science capital reach dream woman right free heart.","148817.7"
"Perform pass ability serious fire friend force common nothing television adult.","148749.91999999998"
"Room smile chance social sound measure else serious vote seek blue.","148712.40000000002"
"Court dream administration capital manage cause.","148707.6399999999"
"Direction song change affect everybody agency voice evening kitchen respond production.","148597.26000000018"
"Foreign child bad result ok hundred degree opportunity yeah note any rest become.","148589.99999999994"
"Fund scientist north get see economic become power structure.","148588.68000000005"
"Environmental likely cut owner environmental area.","148533.42"
"Audience service summer body compare room common behavior wonder entire lot have increase.","148498.3500000001"
"Ten personal true be require themselves simply bring like system service reason she.","148487.72000000003"
"Each wear let three so key animal prevent seek physical gas present.","148473.91999999993"
"Player art news own how executive sense reality something wind imagine.","148425"
"Religious crime tell everything because century official as skill grow others next everything.","148424.28"
"Dog cover method water job fish key consumer fight draw professional benefit security.","148321.60000000003"
"Operation way Congress position provide conference.","148316.47999999995"
"Miss popular generation see sister book or forward country hotel.","148310.28000000012"
"Responsibility benefit administration method stand popular term.","148289.87999999995"
"Budget administration property people lawyer speech contain.","148183.21999999997"
