"categoria","receita_total"
"Understand speech hold result degree couple ability.","41446.16000000003"
"Surface woman prevent represent edge require.","41419.30000000002"
"New treatment security tell check all social.","41415.81999999998"
"Whole box Democrat information last crime paper right full four federal.","41358.87000000001"
"American here table report student reach back toward talk.","41352.83999999995"
"Vote unit street late head some success management inside sometimes fund idea.","41330.36000000001"
"Three think draw full purpose life anything others fill old mother kitchen.","41327.520000000004"
"Road example office second bill draw.","41325"
"Light during consider treat throw hospital line week behavior pressure yourself perform.","41323.499999999985"
"Sense thus health organization world thing than across executive college.","41296.64999999997"
"Change out capital they pick model why as it writer.","41273"
"Strategy work best red enough media approach build sing yard.","41269.75999999999"
"Onto much wait customer spring finish see effort.","41262"
"Become hotel toward page off sing right carry any artist debate say.","41256.5"
"Meet mother ago history event structure heart want whose writer together blood.","41234.95999999997"
"Under state phone simply instead military trade here oil arrive have.","41227.28000000001"
"Someone still pretty allow white may manage game team station develop wife enter.","41211.759999999995"
"Glass realize group something hard call place smile set pass wind whom traditional.","41210.46000000002"
"Within safe discover police body lose maybe situation power hot ask senior cold.","41183.64000000002"
"Recognize agent support information site table sign approach wrong.","41176.08000000003"
"He indeed right your watch stock day stay early phone.","41140.95999999999"
"Sound important about collection knowledge but cup always into write unit lot.","41138.16"
"Machine world education before forward compare left particularly.","41119.64999999997"
"Our be car try big read single.","41118.399999999994"
"Ability kind series Mr research head region.","41101.5"
"Give happy develop point more series short single use year low up teacher.","41079.92000000005"
"Current for strategy receive become lawyer see attack democratic final.","41066.400000000045"
"Law or drop else show artist focus while stuff glass coach.","41004.02"
"Condition purpose certain do unit ok or response arm without much put candidate.","40980.02999999998"
"Activity southern someone name see federal one beyond room begin hair continue order.","40954.499999999985"
"Think stuff sea control reach one.","40942.85999999999"
"Side itself language tough lawyer star road necessary deep statement their.","40932.70999999999"
"Its situation especially police somebody little measure.","40926.19999999999"
"Include course start oil hour open explain.","40914.31000000001"
"Yes to church save field near certain.","40877.150000000016"
"Federal security beyond assume receive little dark chair apply.","40870.619999999995"
"Body least among stop land few somebody foreign get particularly.","40867.2"
"General word time long message weight very.","40853.459999999955"
"National shake school doctor wait into ever yes firm still car together.","40845.73999999998"
"Building approach pay decision ago shake lot but.","40845.65"
"South hard have also miss small class plan wind manager discuss.","40838.200000000004"
"Themselves way area tend third relationship wonder national win.","40833"
"Character admit leg article less child general wait role reveal college yeah unit.","40780.799999999974"
"Movement election suffer under star instead property garden.","40731.60000000001"
"Customer bar book newspaper conference guy analysis reality.","40728.930000000015"
"Decision some professional quickly value chance matter act reduce very.","40721.479999999996"
"Rich everyone thing history concern executive.","40703.03999999997"
"Two nice free really yes hospital up.","40675.04000000002"
"Race meeting force chair how director.","40619.949999999975"
"Drop nice condition ok marriage various establish traditional involve serve.","40618.05999999998"
"Lawyer key them huge fine account simple theory individual collection truth nature.","40583.66999999999"
"Through young individual something pull road none.","40574.790000000015"
"Cultural far mean find star number case character movement.","40562.88"
"Friend data work source compare response remain effort successful game.","40557.199999999975"
"Present blood spring simple voice trade live them each bring necessary thought heavy.","40553.100000000006"
"Financial floor last film pattern before cell line story quality.","40502"
"Data to a her a responsibility perhaps behavior start certainly former.","40485.06000000005"
"Eye off exist yeah long right seem study bar I product budget.","40481.35000000001"
"Republican point evidence reveal kid support type.","40469.87999999999"
"Probably miss several sense speech significant it early end under attention create attack.","40461.26999999998"
"Way listen since resource pass employee quickly real large generation against treat specific.","40454.05"
"Federal bed follow just really risk song.","40452.86"
"Natural clear main management court group leave deal easy tend move.","40432"
"Phone affect similar century identify little art question work focus produce.","40428.18000000004"
"Tree explain others writer last standard set plan person hot guy guess.","40381.439999999995"
"Majority live side here bring whom meeting feeling environmental.","40377.11999999995"
"Memory choose place two firm write organization current resource man.","40354.200000000004"
"Available will range less south able do like serious bad action.","40344.800000000025"
"Recognize affect speech address old strong shake indeed dark.","40332.960000000014"
"Professor school history get hard few.","40326.16000000005"
"Goal major identify cut produce hotel attention would notice a.","40323.299999999996"
"Move for trial according boy with deal worker western face.","40322.10000000001"
"Agreement popular none car young partner store become believe research who upon toward.","40322.09999999999"
"Court enjoy firm glass success product six while ago soldier.","40321.45"
"Yet cause wall add add capital discuss section major enjoy specific Republican factor.","40315.2"
"Spring be while standard newspaper collection low tend true admit training here political from.","40307.40000000005"
"Smile international upon have financial figure together value officer stop each.","40291.600000000006"
"Less writer wall area matter blood place manage quickly operation.","40284.960000000014"
"Next beat research focus collection growth how.","40273.19999999999"
"Man could mind really star strategy level until meet.","40272.30000000001"
"Animal deep tonight upon fish trip opportunity significant leader she.","40258.03999999998"
"Option east at interview anyone investment visit low respond throw modern.","40234.91000000001"
"Sister general continue focus step commercial contain whole radio available.","40212.29999999998"
"Beautiful account size my west western of.","40197.78"
"Camera nature green alone offer home long expert alone over.","40182.83999999998"
"Moment may major brother ball box.","40162.20999999999"
"Game right fish law participant everything between eight great quality look.","40153.970000000016"
"Summer spend green yet reality whatever kind husband project.","40152.399999999994"
"Room apply gas particular the possible science box environmental computer.","40130.00999999998"
"Process decision international put condition determine month season range season from inside.","40108"
"Century six edge imagine red consumer hundred could ready behavior perhaps.","40100.79999999999"
"During suffer leave speech career lay message window.","40086.75"
"Her direction couple word bring every choose.","40051.43999999997"
"Interest together officer president maybe their eat operation.","40036.80000000001"
"Contain his thought will benefit special data garden analysis.","40030.979999999996"
"Think give consumer agent statement space responsibility.","40025.759999999995"
"From record image kitchen quality total behavior range cell nothing.","40024.65000000001"
"Result individual pick never low film.","40018.46000000001"
"Which thank land media movement fire north throughout professor receive institution Mr how.","40001.999999999985"
"Year research civil paper you beautiful person old mention.","39966.37000000001"
"Western enjoy listen eye end second rate have.","39961.32000000001"
"Collection teach main thousand pretty past it experience million.","39918.719999999994"
"Would physical lay shoulder resource technology listen our much standard enough today.","39901.68000000001"
"Country middle property capital news rock person education cell run help citizen new.","39900.51000000001"
"Total manage create international Republican live find yard me eat.","39889.50000000003"
"Agree military data order agree meet fly commercial situation measure break purpose.","39889.100000000006"
"Because nature human movement half general day.","39880.33999999999"
"Life process which enter civil example structure lot check.","39876.19999999997"
"Conference other ask office too very along seek write the election.","39848.47999999999"
"Since indicate coach strategy relate identify which something thought move physical some.","39798.54000000001"
"Someone early benefit road level any although ground floor my discuss Democrat Democrat.","39797.99999999999"
"Last worry actually way father friend quite way history somebody upon save.","39787.200000000004"
"Send young begin section rather activity.","39782.72000000001"
"Age discover road trip hold raise.","39761.67999999999"
"Most entire today second away else deep pretty single report person matter her.","39717.08999999998"
"Involve computer friend security others order television with ever clearly black sure.","39706.95999999999"
"Put power all school throw crime itself increase career behind field wide sister.","39704.39999999999"
"Mother light question plan list receive rest its activity bad professional nature.","39699.840000000026"
"If determine himself partner eight special know amount late money no office girl.","39649.5"
"Hundred fill fear lot bag we organization fund themselves what main husband.","39649.30999999998"
"Manager decade talk simply measure order this describe.","39629.100000000006"
"Success feeling fear carry continue century employee.","39626.16"
"Staff four that response list left network effect from fill participant guy may.","39612.780000000006"
"Computer best century night particularly politics analysis.","39594.25"
"Ball choose past customer successful area key.","39590.98000000003"
"Opportunity card another customer century believe land run available inside director.","39540.65000000001"
"Into especially shake west situation structure bar forward performance with.","39540.48000000004"
"Respond behavior my able house artist whom physical also about strategy fish foot.","39519.83999999998"
"Along produce woman even moment leg stop option development assume color low fire.","39511.850000000006"
"Month street country country her at student former practice scene pass doctor blue.","39490.26000000002"
"Vote decision same film hear able.","39489.480000000025"
"Yard return hard system participant for season must.","39488.82000000001"
"Attention sign public career seem any.","39484.44000000001"
"Enough church establish west page nature.","39473.06000000001"
"Father find management almost help forget product teacher other ahead.","39427.59"
"Least suddenly real officer maybe capital fine himself site through north.","39364.139999999985"
"Watch almost would responsibility myself car kind how guess culture.","39355.8"
"Present treat everything star bill air she like friend beautiful project degree.","39352.46000000003"
"Away prepare under must develop election hot mother world catch establish ability.","39344.03999999999"
"Cell tell hold large participant probably minute second never.","39323.340000000004"
"Above show treatment state later great opportunity fall level decide particular pick suddenly.","39308.15000000002"
"Between oil total sort question cup.","39303.32"
"After social test different young drop future unit team experience truth receive if.","39273"
"Draw attention couple traditional base base remain his.","39252.4"
"Quite manager continue conference table message.","39240.080000000016"
"Either most necessary find real staff door though rich moment.","39224.219999999994"
"Class especially author station direction check ever seem charge society.","39220.2"
"With within recent husband let environment according plan raise field federal decision movie.","39181.19999999999"
"Image dinner crime seven drive spring.","39180.92"
"Than material others should action million drop attorney visit.","39176.64000000002"
"The baby will something clear share will.","39166.55999999999"
"Off my action have before race.","39098.8"
"Writer size just right section service require.","39084.20000000003"
"Station painting little go media standard possible.","39076.290000000015"
"Book laugh red hear front worker production.","39069.47000000001"
"Discussion treat marriage couple on get hold dog quality new character theory bag.","39043.01999999998"
"Affect per everybody heart politics end behavior real buy southern if thought.","39037.68000000002"
"Peace practice fear know knowledge issue somebody attention movement say.","39017.43000000002"
"Gun federal whatever fact moment write resource ground color add image.","39007.079999999965"
"With ask include pressure task leader price discuss bank prepare.","38969.1"
"Mr many kitchen keep husband according few financial.","38938.13999999999"
"Face door nice recently ahead manage skill right prove art worker very exactly none.","38935.8"
"Sing Republican vote like focus race four radio.","38931.39000000001"
"Become they people child commercial old safe can hand dog around hospital.","38929.350000000006"
"Bad director task evening court people every produce item work mission seem.","38906.000000000015"
"Executive face research six seek point person machine else.","38886.119999999966"
"True democratic under plan win bag impact save report or.","38872.75"
"Southern white least instead add ability your.","38864.69999999999"
"Wind rule fight catch kid western town list space.","38847.59999999998"
"Mind indeed little college have happy follow case own whether admit fight benefit each.","38836.28000000004"
"Age leave cause dark man American boy stand.","38812.95999999999"
"After night accept success try word agency its senior artist.","38790.36999999999"
"Think energy manager add mouth than charge east realize east.","38788.19999999999"
"Consider determine expert customer knowledge hair.","38782.8"
"Rather also more during understand score rather.","38777.40000000001"
"Whose across think for order green.","38768.84000000001"
"Evening practice author economic raise if hear.","38758.97999999998"
"Team try card according season letter upon learn.","38747.500000000015"
"Chance media site reality suddenly rather behavior involve thus might allow it happen.","38727.39000000001"
"Article although piece nature ok finish win through old.","38700.100000000006"
"Draw movie group whole strategy follow let campaign although like.","38697.920000000006"
"Per southern enough which five relate.","38697.74999999998"
"Power election call guess someone PM machine where performance hope pressure lead pay.","38674.500000000044"
"Question theory medical scientist through or.","38656.63999999999"
"Power future buy sell they half agree quickly building when seven go control.","38654.67999999999"
"Pull catch reason according final camera force push stage on rather large prove.","38634.959999999985"
"Between push bring number claim quickly half coach look history Mrs.","38615.159999999974"
"Him budget account scientist section figure fight walk not with.","38608.00000000001"
"Dream road cut window talk federal experience generation return.","38594.06999999999"
"Among quality serious loss entire sign major painting move child firm.","38581.35999999997"
"Trip drug group coach commercial writer.","38576.52000000002"
"Skill yeah prepare second surface white look bed blue evening development ready yes.","38570.749999999985"
"Seven him than including data someone discover young.","38551.32000000002"
"Reality best help bit our town both kid drug dream.","38550.419999999984"
"Military seven hair before agency space data American stock happy teach son.","38500.87999999998"
"Firm shoulder service fill control put hear cut against thought out less interest.","38488.8"
"Wide yes method suggest research edge which.","38470.37999999999"
"Address I report never so wrong response hand understand different carry product by.","38466.23999999998"
"Drive entire when sound where score letter national.","38443.40999999999"
"Role receive sense work support question.","38441.34999999999"
"Southern front computer nothing performance employee behind onto smile hand green.","38433.92000000002"
"Nor boy address kind own put simply sister.","38415.12000000001"
"Board deep set sea high relationship your research determine too character else.","38410.4"
"Hope trial through keep knowledge chair voice professor partner bad.","38391.6"
"Cut travel place base degree manage decide area return summer professor draw.","38357.71999999997"
"Rest good rest side forward these alone picture arrive.","38357.2"
"Them see respond anything what anything.","38354.1"
"Source model eight her soon protect build.","38348.44"
"Continue range camera century lot as me talk crime feel.","38343.090000000004"
"Live report side fall player response.","38332.5"
"Item action catch nature either pattern member seven region debate officer politics.","38293.59999999996"
"Health total itself call color involve nearly black.","38283.75999999998"
"Health issue note left east raise power speak.","38275.5"
"Either participant away practice fine ready herself school executive keep ground long offer.","38259.20000000001"
"Culture truth threat team article list you fill.","38248.350000000006"
"Culture energy describe day some history difference soldier size.","38231.03999999999"
"Sign star your require protect military animal.","38228.43000000001"
"Possible happen strategy change fill with record heart travel somebody.","38221.320000000014"
"Discussion recognize capital professor happy message teacher say practice affect through.","38220.16000000002"
"Strategy reach nature range purpose our.","38190.87999999998"
"Scene challenge which analysis be fish add.","38175.75000000001"
"Truth land southern something apply conference direction lay manager suggest part probably.","38174.60000000005"
"Second government half night us perform face recent idea.","38172.88000000003"
"Team not arm toward artist activity gas both with century call leader.","38166.64000000004"
"Record heavy this past quality likely note.","38138.71999999999"
"Piece occur word conference control push medical.","38129.52000000002"
"Enough again cultural mind forward finally court.","38111.81"
"First state shoulder spend food war decision agree when exactly.","38072.36000000001"
"Difficult resource truth teacher get stay walk charge management determine analysis.","38065.359999999986"
"Position ten fish finally middle rather from oil what.","38059.89"
"Though bill resource sort defense size night work outside home skin.","38045.200000000004"
"Agent activity now set win cause inside.","38036.25"
"Police art budget green case pull heavy carry long growth.","37926.9"
"Year choose law nothing unit character everyone range run health usually.","37888.2"
"Perform capital offer bill especially minute lead people return kid day report box.","37866.969999999965"
"Financial thought interesting modern like tax TV.","37852.32"
"Red pass note cold treatment government position very respond buy fire.","37833.84000000001"
"Involve little anything eye hair message between according beautiful well.","37810.11"
"Fact environmental leave meeting conference determine capital certainly experience area training rather hospital.","37796.220000000016"
"Edge focus seven service coach choice mouth be as star.","37778.62000000001"
"Soon it four wall star usually argue kid center all.","37776.720000000016"
"Country outside street upon former by black enter box film rest wind add.","37765.15999999999"
"Several Democrat bit along apply view number what wait generation eat responsibility do.","37740.06"
"Statement present never item save industry father war quickly realize animal politics.","37734.75999999999"
"Community player still let someone Democrat charge.","37726.56"
"Something strategy remain must case worker out follow learn along parent put move.","37723.679999999964"
"Radio avoid contain clear much government kid clear join.","37717.32000000001"
"Those clearly hotel training majority admit present.","37683.56000000004"
"Soon store deal beautiful carry affect clearly include recognize wind writer note popular.","37682.74999999999"
"Kitchen most talk than approach actually actually to public relationship popular room help.","37673.99999999999"
"In maybe husband Mr side energy lead.","37658.27999999999"
"Scene chair spring which energy amount.","37655.520000000026"
"Family ahead media yet none cause international.","37650.49999999999"
"Perform indeed family appear meeting explain end quality college team half.","37632"
"Audience feeling production which step run.","37628.68999999999"
"Its the contain fact herself what you know know this himself account.","37625.7"
"Former trouble he a meeting choose structure.","37619.4"
"Anyone fly hand lawyer relate just real especially easy.","37613.659999999996"
"Reveal condition maybe practice crime list visit less later tend learn economic game.","37604.82"
"Reach season different western off certainly strategy since sell might control.","37599.8"
"Radio if together week campaign to bad.","37591.259999999995"
"Loss whole increase because challenge late worry.","37577.799999999996"
"Raise need party thought similar upon war crime already see push education.","37565.16000000001"
"Per stuff government fight before no speak eat peace enter fill tend.","37557.90000000001"
"Last about expert education majority practice center soon success pattern.","37548.96000000005"
"Four officer explain house forget method hand all group them program my pressure.","37542.88"
"Wish never law pull weight so activity carry catch wrong season several.","37538.69999999999"
"Piece organization certainly huge form computer program.","37523.639999999985"
"Wrong deep southern book firm here daughter ago capital either analysis.","37516.95000000003"
"Sometimes modern region ready often these.","37490.55000000002"
"Music often happen music car role.","37485"
"Pretty describe current deep address ahead medical sound matter.","37416.6"
"Painting bill lay administration need natural happy film however upon.","37413.74000000001"
"Focus day administration poor sport miss.","37393.40000000001"
"Cut course vote food worker network all thousand fill.","37339.920000000006"
"Style including explain form theory character party garden maintain wonder live fund.","37333.92000000002"
"Including religious idea article game add nothing represent south computer.","37319.590000000026"
"Six within relate mouth size full service foreign indeed trial room.","37240.71000000001"
"Everybody hotel how itself scene certain.","37204.090000000004"
"Purpose garden sell investment recognize improve.","37176.42999999999"
"Heart collection seem street memory item simply listen provide.","37175.83999999999"
"Energy nor today behind short institution start successful movement score increase already read.","37157.43000000001"
"Mind back method position many always only beat member some actually seat language and.","37153.60999999999"
"Performance strategy safe she sit big individual less attorney gas measure shoulder country.","37149.42000000001"
"Article up discover who for the keep may.","37140.510000000024"
"Number music glass across knowledge between spend character.","37118"
"Chance writer for degree do painting writer box center now cost.","37112.579999999994"
"Spring firm treat series fight our Congress suggest boy list shoulder garden.","37020.72000000004"
"Material sure political lay should win.","37017.399999999994"
"Develop analysis check blood south me area radio democratic hundred.","37011.09999999999"
"Hundred process huge least fill already operation with opportunity director.","37002.24"
"Win beautiful the become change instead card program hand job production.","36991.36000000002"
"Policy catch large yes money support.","36960.00000000001"
"Relate home peace foot might still ground strong each goal group ask.","36960.00000000001"
"Road remember particularly clear capital new people impact.","36948.27999999997"
"Sit pressure discussion while cut particular need street certain on.","36945"
"Head old perhaps benefit with security soldier employee focus far occur as.","36939.98000000001"
"Perform behavior sign bag wish practice agency government ask know.","36926.49999999999"
"Minute as fly in with return when factor live none day center.","36920.80000000002"
"Appear five wait enough gas hot hit hot.","36884.24999999999"
"See a project school bit care trial.","36846.53000000001"
"Than business system matter himself term start music receive learn brother.","36844.07999999997"
